Reviewer,Rating,Review Text
SSG,5,"The movie stayed true to the original, except for a few small details and the lack of ""Le Poisson"" plus the addition of a few new songs. I didn't mind the changes and thought the acting and CGI was really great."
First L,5,"it was great did not disappoint the music was on point, Eric was better than expected, Ursula was very good Melissa McCarthy did an amazing job I got chills through out the whole movie. I felt like a child seeing the little mermaid for the first time"
Christie,5,Absolutely loved the movie
Ellen,5,I thought it was excellent!. Well done Disney!
Chris B,5,Great job with the music and production
Shay,5,It was a fun movie. Why compare the old vs new? They were both great for the decade in which they were made. Will definitely see this a hundred times also.
Alysia,5,"I really enjoyed this! It’s the best live action they’ve made, and the kept the best parts of the old film and added some new stuff. It worked, I loved everything about it."
Stephanie,5,"Gorgeously led by the incomparable Halle Bailey, The Little Mermaid is a beautiful film in every aspect. Wonderful chemistry between the leads, a terrific new spin on a familiar tale, and music to dance your heart out to."
Towanna,5,I loved the movie. Especially the closing scene
Eric,5,Great movie with our daughter!
Rina,5,Such an absolute joy to watch! A must see film!
Mike C,3,"Not too much was different from the original animated movie. They added a few new songs, adapted the older ones only a minuscule of ways. Visually stunning underwater settings. It seems they changed from a black sea region to Caribbean?"
Google,0,"I recently watched the new Little Mermaid movie, and unfortunately, I was extremely disappointed. The characters were not relatable at all, and the movie lacked any original content that was different from the original movie. 

Firstly, the characters in the movie were unrelatable and lacked depth. The lead character, Ariel, was portrayed as an overly emotional and naive character who seemed to be constantly chasing after Prince Eric. Her character lacked any real growth or development, and it felt like she was simply going through the motions of the original movie without any real substance. 

Secondly, the movie lacked any original content that set it apart from the original movie. The storyline was virtually the same as the original, with no real twists or turns that made it unique or interesting. It felt like the filmmakers were simply trying to cash in on the success of the original movie without putting any real effort into creating something new and exciting.

Overall, I was extremely disappointed with the new Little Mermaid movie. The characters were not relatable, and the movie lacked any original content that would have made it stand out from the original. If you are a fan of the original movie, I would not recommend wasting your time watching this lackluster remake."
Tiffany,4,That it was the same basis from the original story but with human  emotions to draw in more connectivity. Only down side is that Sebastian was not the correct animal and that the musical scene under the sea was not Performed in the same manner.
Mia,5,the BEST live action disney princess movie. This was so cute i cried so many times. I cant wait watch it again
Mari,5,Such a great remake! Haile did amazing in her debut movie
Janice,4,This movie was very good! It brought joy to the kids and adults in my family and we all thoroughly enjoyed it together.
Anonymous,4,"It was better than I thought, and I don't care much for original Disney Little Mermaid movie."
betty,5,good movie!! I enjoy it. 👌
Lisa,5,Very nice update to the classic.
kathy,5,I loved the diversity in the movie. Made every little girl believe they can be a mermaid
Alyssa,1,The movie was average songs to slow
Emily,5,Excellent! Two thumbs up!!
Panther,5,The movie is amazing! It’s a must see💙 Everyone played their part. 10/10 would recommend
William  W,5,love the movie and the music
Jenr,5,Loved they kept the storyline with such beautiful scenes in and out the water. The cast was phenomenal
Melissa,5,This movie was wonderful. The whole cast is beautiful and handsome. I love seeing such unity and love.
Aisley R,5,"The Little Mermaid  was a MASTERPIECE and we LOVED it so much! In my opinion, this is, by far, Disney's best live adaptation to date. We can't wait to see it again. I was so excited to see Halle Bailey as Ariel and she surpassed allll of my expectations. She was absolutely perfect. The whole cast was. They truly found the best way to honor the original film while adding plot and film aspects that enhance the film rather than cluttering it or taking away from the essence of the original. My ONLY complaint was that I didn't like the Scuttlebutt song and I didn't feel like it fit into the rest of the film. But it wasn't a big enough deal to tarnish my opinion of the film overall."
Matt B,5,"Halle Bailey is the perfect Ariel. Loved this movie when I was a kid, loved it now. A+"
Kanie K,5,"The movie was pretty good from the images to the songs to the plotline, it had plenty of moral lessons people could take to heart. Sometimes parents just need to listen, don't be selfish, and discriminate against the humans and mermaids! ( talking about the mother). I like the songs it was so fun to sing especially the rap segment. Sabastian was so hilarious with the seagull. 

Halle plaid her character well, she was so cute and talented. She may not look like the original but you have to understand what Disney was going for. The sisters are all from seven seas, in the cartoon they lived on some type of island, and Sebastian being a Jamaican crab was a hint of what kind of island they lived on. So why not go to the Caribbean or something?  So it made sense why they would make Ariel be from the Island. Another thing some black people have ginger hair and blond hair, learn your facts. Lastly, I was hoping Ariel's sisters would have another line, like them searching for her and finding her depressed after finding out about the prince. All in all, it was a good movie, they all did well"
Jasmina,5,Watched it twice already!!
onjenae w,5,This adaptation revamped the story so beautifully every one was phenomenal ! GO HALLE
T,5,I was never a big fan of the cartoon movie growing up much but this live action version was phenomenal! The way they were able to bring this to life was so amazing and I want to see it again. Bravo! Halle Bailey and Melissa McCartney did the thing!
Lauren,5,It was absolutely amazing!!! Even better than expected!
Desi,5,She did an amazing job 🙌🏿🙌🏿🙌🏿
ASYA,5,"Halle was stunning as Ariel she really made it her own. The whole cast was really great! I honestly couldn’t keep my eyes off of her. I cried. There were a few things like the wedding and the dress choices that were missed for me, however my daughter and her friends loved it. I love the diversity of the sea kingdom it was beautiful a true representation of the world. I really can’t wait to see the behind the scenes because this movie is stunning. Bravo 🎉 Disney."
Danielle,5,It was so much better than I expected!!! I’m ABSOLUTELY going to see it again!
Andrea,5,"Loved it! Love the new writing, new songs, new jokes."
Maroco,5,A must see…great movie for the family !!!
Emmanuel J,4,Way better than the Lion King Remake. The underwater effects could've been borrowed from James Cameron
Jose I,5,Disney did a great job in bringing The Little Mermaid to life. Great cast and beautiful colors and scenery. The only thing I could have lived without is the Prince's solo song.
NATHALIE,5,amazing amazing amazing!!!!!!
Marie-France,5,Absolutely beautiful and fun!! Halle truly was the best pick for the role of Ariel.
Matthew Edwards,4,"The music was beautiful, and the visuals were very nice, if little dark. Halle Baily is lovely as Ariel and Melissa Mcarthy does amazing as Ursula."
Sindy,0,Wish this film would have kept the script original. Very rough to sit through. Come on Disney! Do better! Very disappointing.
Carol,5,The best live action Disney movie depiction I have ever seen!!
Chris Nick and Mama,5,I liked when Scuttle said Bow Chicka Wow Wow and when Ariel was looking at the crystal mermaid. The sound track is still a gem and new songs too! Captivating and wonderful.
Azariah Madej,5,"Ive always loved the little mermaid and was worried about the changes but the movie was wonderful! Halle Baileys voice was amazing, I love how they made it more realistic and gave more to the story!"
Ashanti M,5,Amazing. Halle did her thing!
DONNA S,5,Great funny movie for everyone
Nicole S,5,"I was pleasantly surprised with the quality of this remake. Acting was great, singing was on point. The humor from Sebastian was spot on. Although it was a bit jarring to see Flounder & Sebastian more “realistic” vs the catoon version, it was still great! Halle Bailey acted very well & Melissa McCarthy did just as well too! Great casting!"
Shanasty,4,"A genuinely good family family. I thiblnk there were some boring moments to my son but dafinitely some enjoyable moments too! Some things I wish they hadn't changed and some changes I thought made the movie better. I did not care for the actor who played King Triton, no offense to him, he is probably an excellent actor, just not someone I enjoyed playing the character. Halle Bailey was an excellent choice for Ariel. She played the role exceedingly well. Aqua as Skuttle was....an interesting choice. There were ups and downs but I would say she did alright to entertain. Made my son laugh. Sebastian's voice could have used more emotion within his dialogue when it was needed....you can't see much emotion with a real crab...but he could have showed it more in his voice somehow. Wasn't a fan with Ariel steering the ship at the end instead of Eric. All the the musical portions of the movie were amazing!!!! I would have liked to see more sea animals for Under the Sea but aside from that it was great!! The Little Mermaid, animated version, has been my all time favorite since I was a little girl so this is just my critique coming out due to it being a favorite with all the changes. If you are a true fan of the previous movie, I suggest seeing it. I had my doubts due to people's comments and predictions before but after seeing it, let's just say the pros outweigh the cons for this live action movie remake."
Zach M,5,"Halle Bailey is a growing young actress who is perfect for the roll, which is only the start of her career."
Angelica,3,It was a cute movie but didnt really like how they changed some essential parts towards the end in my opinion. Will watch again though when it comes to Disney+
Rachel,5,My favorite Disney live action movie so far! Halle Bailey made the perfect Ariel.
Patricia,4,I loved the movie cause my 6 yr old granddaughter had a grin from ear to ear the whole time.
Ashley,5,"It was fantastic. I loved the additions they made to the original. At the same time, they did the OG proud!!! Everyone should go see this."
Rich P,5,"At least as good as, or better than, the original animated version in all respects. Only significant shortcoming was the casting of Javier Bardem as Triton."
Facebook U,3,Got week at the end. Could have found a better actor for king Trident. Several changes from the original classic.
Little Mermaid Fail,1,Bad acting and the movie flow seemed forced
Clara,5,"Loved the new version, songs, voices, actors were all incredible!"
Delaine,5,"The movie was flawless, we absolutely loved it"
James,4,Very lovely film had new elements with a nod to the classic of course. Very amazing would watch again
liz,5,"This Disney re-make is delightful.  I loved the way people of all races were portrayed.  Ariel couldn't have been better.  It is a little scary for little kids, but older kids will love it.  The cast was incredible and we thoroughly enjoyed it."
the hottest mermaid alive(besides ariel),5,I LOVED IT! It was such a beautiful movie like omgggggg
Shalonda,5,Enjoyed the singing and the ending made me cry
kellie,5,Movie was AMAZING I CANT WAIT TO SEE IT AGAIN!
Antoinette,5,Amazing!!! My childhood is complete!!
Stefanie,5,The kids and I loved it! We saw it in 3D! I love that they kept a lot of the original songs!
Bradford,5,I the differences they made to the story in this updated version of the movie separate from the exciting diversity! Very enjoyable!
The Little Mermaid (2023),5,"kids loved it. The people on  theater yelled, and clapped when it was over. kids were quiet and watching the whole movie!"
Chrissy,3,It was a little rushed
Alisha C.,5,I loved everything about this movie! So sad people are basing their reviews off the color of her skin! Welcome to ameriKKKa
Maleah J,4,"there were parts that were amazing, the colors, the animation on point. there were parts that were a little clumsy, the interaction of actors and live action. overall, good job."
Mirelsa C,5,I love the whole movie. It was beautiful! They chose the right girl to play Ariel. I cant wait to watch it again.
ChanV,5,"I considered myself a hardcore little mermaid and Ursula fan. Going in I was kinda nervous that they might ruin the classic like some of previous remakes, instead i was blown away. From the singing, new add-on songs/scenes/characters’ background to the parts/details that they cut of from the original, making this the best live action adaptation yet. Every decision to include or exclude certain elements from the original was carefully thought-out, it doesn’t take away the beauty of the original story and it doesn’t overbear/bore like if it was taken frame by frame from the original. Halle is a solid singer/actor “period”. Her performance smacked a lot of rotten eggs on haters’ head. People keep picking/mocking on the part where she sing the word “FREE”, completely blinded by that add-on style of singing/dialogue, they seemed to not understand why it would make sense to keep that cut of the song and missed the other of wonderful things she implemented throughout the song. Melissa’s Ursula was chef-kiss. Jonah was perfect as a prince should. The whole cast was wonderful. I think people do not give this Sebastian enough credit, sure the animated/realistic crab could be a little better, but Daveed’s performance is definitely up there for me. Lastly, if you are going in just to look for something to hate about this film, you gonna hate it, regardless of the other million things they did right, so be open-mind and Hope you enjoy it as much as i did!"
ElissaE,5,It was better then I thought it would be. We loved the movie.
hycrew,4,"Very colorful, stunning visuals. Despite similar story, it wasnt a shot by shot remake. Melissa McArthys acting as Ursula was really good. 
Sebastian was super cute.All the voices were really similar  to the ones from the animated Little Mermaid."
Donetra,5,I enjoyed the whole movie! Seeing it in 3d was the absolute best
Sasha g,5,Amazing live action. Updated but still true to the original story.
Pamela,5,"The Movie was Great! Hailey done a great job! All of the Characters were great. I like the plot, Disney done a great job. Definitely a must see and a movie you want  to have in your favorites collection."
Pearl,5,"If you loved the original animated movie, you will love, love, love this version.  Little Mermaid was the first movie I took my daughter to see. she was only 2. Little Mermaid has always been her favorite movie...now X2."
Nirline,5,"I love everything about it, my children enjoy it. The actors/actresses were awesome. I like her dated with the prince. This version of The Little Mermaid takes all the awesome moments, dialogue, and songs from the original and adds a modern flavor to it. Even the new songs were great, with the Scuttle song in the style of Lin-Manuel Miranda being a nice, entertaining surprise. The pacing was perfect and it knew exactly how much time to spend on each part of the story, not overextending at all. It understands comedic timing so well, and the casting choices for Ursula and Sebastian were genius. This version of Sebastian was top tier and Melissa McCarthy brings her all. Hayle Bailey was awesome as always."
Hans C,0,Such a disappointment.
prettynikki,5,Loved this movie. Didn't think I would say this but it's better than the original.
jambrownin,3,It was whitewashed and they didn’t have chemistry.   The little mermaid and Úrsula were great!
Eddy,5,"This was such a great production! So far the best Disney live action, and the actors were on point! Halle Bailey is a queen, she is so perfect for Ariel. I will be rewatching this movie"
Gerardo,0,"It felt like a bunch of people in one movie trying to remake the little mermaid.  My daughters favorite princess and one of my favorite movies, just could not connect to this movie."
Eyanna,5,"Loved everything about the movie! I laughed, cried, recited words, sung the songs and danced along to the new tunes. Fantastic job!"
My R.,5,This is how you remake a movie! You leave it like the original
unknown,3,"It was half and half for me, Ariel has a great singing voice, and Eric was good, but there were some people acting that was a bit disappointing, and the new songs were okay but they just didn't fit with the vibe that the original soundtrack, and they took out the best scenes that the original animation film had which was disappointing as well. For me personally at the beginning, it was a bit boring but towards the end, it was interesting especially when Ariel finds out about Ursula."
Jameelah,5,"I loved it so much, my daughter and her best friend also enjoyed it."
Monica H,5,Loved it.  Halle Bailey was great.
Brianna,4,"Clever substitutions from my childhood version,  a must see!"
Samantha,4,"I love it. There were a couple of things I felt they could have done differently, but as a whole, I loved it."
Jessica,4,Amazing! Halle is a superstar. Flounder and Sebastian could have been done better appearance and animation wise.
Ruby,4,"Good movie. The moral of the story is, two culture can come together as one. God is the creator of all.  Love conquers everything and everyone. Prosper together and let God do the judging. Be blessed."
Christine,4,"Very well done!
Reimagined beautifully!
Wonder filled!
Not a fan Eric,s first song"
Leslie,2,"The story line was changed, the characters changed and the songs that made the movie a hit and fun to sing along with back then were also changed. And these changes were not for the better. The characters were not fun or engaging.
The acting was weak, the backgrounds and settings not attractive."
Kenya,5,Amazing remake of this classic! Halle fid amazingggg and Melissa McCarthy is also GOLD on the screen!
evangela  m,3,I enjoyed it but the acting was very blah. Only person who seemed to give it their all was Melissa McCarthy. I loved the new songs and the take on the originals.
Hope,5,My daughters and I absolutely loved the diversity throughout the movie! Hailey Bailey did an amazing job!!!!
Sharon,5,The movie was so vivid with all the colors in the ocean. Halle Bailey was a wonderful Ariel she did an awesome job.  I would give this movie 100 %
Nikki F,5,"I loved the movie! it stayed true to the original story and I liked the added character development for Eric. Halle Bailey was phenomenal, her voice is magical. Ursula's  character was well played by Melissa McCarthy and Sebastian and Scuttle were great comic reliefs. I thought there should have been some flashback scenes with Ariel and King Triton to establish  their relationship more....their chemistry was flat. Overall, it was a great live action remake!"
Brenda,5,"I loved the beautiful sea animals, colors, songs, and theme."
Kayb,5,"This was a great family movie! Brought back memories plus new ones. Tip, don't bring children under 4 years old, it's not animated so it will not keep them entertained. Crying babies and toddlers is annoying."
La Toya,5,"I love the story, action, and the graphics of the movie."
Jemond B,5,The performances of the entire cast were amazing! Obviously the songs in the Little Mermaid were Caribbean so it was great to see the representation in the movie as well
Ms Pandalove,5,It was an excellent movie!  Top notch  I would recommend all ages to see it. Perfect vocals and photography. I would see it again.
Keoni D,5,It was absolutely one of the best live action movies Disney as made to date! I cried so many happy tears and I know Ill watch again and again just like the original animated version! 10/10 its a must see! I would give it more than 5 stars if I could!
La Mar,5,"The movie was well done, fun for young children and families alike. One we'll see again."
Shari,5,"The movie was captivating with the music , songs and colorful scenery from start to finish. Halle did an excellent job as Arielle and Melissa as Ursula. The comedy was on point as Sebastian and other characters. The children and adults in our audience applauded and LOVED it!"
Jaeden,5,Halle Bailey did such an amazing job as Ariel! I dont think anyone else could have brought the character to real life the way she did. The rest of the cast also did a great job and the music was incredible!
Daniel,4,"Overall, I enjoyed the movie.  My girls have seen the original many times and also enjoyed the movie.   They didn't sing my favorite song. I'd be lying if I said I didn't laugh or have any emotional connection to parts of it.  if my girls wanted to see it again, I would go with them."
Thomas B,5,"The cast was terrific! Great live adaptation -- the ""Under the Sea"" choreography was beautiful!"
Briauna,5,I loved the movie. It was good. Has its own twist but still gave me nostalgia of the original.
Michael,5,"The movie was great. From the visuals, to the music, to the acting abilities of the whole cast. I had a smile on my face during the whole movie. I tried to look get rid of that smile on my face while watching the movie, but it was stuck there the whole time. I want to see it again 😅"
JM,5,Halle and Jonah were great. They had amazing chemistry. Sebastian and scuttle were funny. Didnt love the VFX but the movie was really cute. So many goosebumps during part of your world!!
Marie-Claire G,5,I absolutely loved every minute of it .
Nadya,5,Such a great movie!! A new take on a classic with elements of the original film sprinkled throughout.
Beatrice K.,5,The singing was great. My husband who was reluctant to got is still talking about it this morning.  Another Disney classic that I can’t wait to watch with the grandkids.
Julie,5,It was an awesome movie. Magical
Tonya,5,"It was a WONDERFUL movie. I Thoroughly enjoyed every second. The actors, theatrics, sounds, singing and animations were incredible! I strongly recommend!"
Danielle,5,Amazing !! it was done perfectly ! and the smile on every child face who sees the representation is heartwarming !
Kristi,5,The movie was awesome. The theater...not so great. You can order food from your theater seat and they'll bring it to you. Servers were bringing food to people all through the movie. It was very disruptive.
Jasmine,5,BeautifulBest Live Action by far !!!! Go watch in 3D
Mary E K,3,"The movie is over 2 hours, far too long for any smaller children to stay interested.   The original animated LIttle Mermaid was only 83 mins.   This movie had many cute scenes, but it had some scenes that smaller children would find horrifying such as the shark scene.  It just wasn't as fun as the original animated movie.   We missed seeing the scene with the chef and Sebastian, and no one can live up to the Ursula voiced by the late Pat Carroll."
Not thrilled,4,Movie was good. Well done. However the theater sold our seats not twice but three times. People found seat elsewhere but the back row all had multiple people with the same tickets. The theater owner has no idea how it happened
Alicia,4,"Despite what a lot of people said about it, I thought it was a really good movie with a great cast! The only thing I can really complain about is the Caribbean accents. I love Daveed Diggs, but the Jamaican accent just wasnt giving honestly (coming from someone who is Jamaican btw). I love the additional songs and as much as everyone else seems to hate to admit it, Lin Manuel Miranda lyrics are always baller."
Melissa,5,The movie was awesome! It's sad how even in a kids movie people really lead with their racist thoughts. Change the race of the mermaid and all is forgiven.
Marsha,4,I love the lesson to the story.
Cynthia P,5,"Loved the characters, the singing and especially Hallie Baileyportrayal of Ariel, absolutely amazing!"
Nina D,5,My Daughter loved it
Ashlyn,5,"AMAZING!! The music, visuals and acting absolutely incredible."
Tammy G,5,Excellent movie!!! One of my favorite Disney live action movies!!!!
Mikisha,5,I love the new take on this original classic. The diversity of merpeople from different seas is wonderful to see. I think I enjoy as much as my 7 year old daughter.
Sherrell,3,I liked it. It was cute. The Little Mermaid was never my favorite Disney movie but I would actually watch this again
Kurt,5,The look and feel of the movie were perfect for the type of film that it was.  Good casting.
Andrea,5,"The movie captivated my attention from start to finished! I love the storyline and all of the amazing details in the movie, too! The actors were phenomenal as well!"
Google,4,They made the right changes to the movie which made Ariel become a princess I can get behind and respect my daughter growth and development
CEmery,5,Overall great movie! Halle was amazing! Her singing and acting were on point for her first major role. Disney could have done a little better on the CGI of being underwater. And I liked one of the new songs with Scuttle and Sebastian. Go see the movie for yourself!
