Reviewer,Rating,Review Text
unknown user w/ taste,4,Beautiful scenery and musical accompaniment. Lots of dramatic twists and unexpected plot points! Would definitely recommend a watch (ps. leave the kids at home for the sake of everyone else. wait. until. it's. on. disney. )
Kelly,5,Visually breathtaking!! You must see this movie in 3D
Taneisha F,5,It was refreshing…it was beautiful and all things magical! Such a diverse cast and with so much chemistry…loved from start to finish 🧜🏽‍♀️
JoAnn Page,4,"Loved ::::
The beautiful colors . The songs 
No dislikes"
Lee white,5,I loved the movie. Me and my grandchildren had a ball. The movie theater was clean and comfortable
monse,4,really beautiful cinematography
LA,5,"The movie was great The young lady who played Ariel did a great job, beautiful voice beautiful actress it was all-around good"
Els,2,I didnt expect so much to be different from the original.
Larendra M,5,It was beautiful. Not only did we love it but our daughter enjoyed it as well. Wish we could've given it 10 stars. Definitely will be going to see it again with the other kids.
Jazz,4,"Halle Bailey, Melissa McCarthey and Daveed  Diggs understood the assignment."
Rosy,5,"It was 98% to the original movie, the cast was peeeeeeeeeeeeerfect from Ariel to Sebastian, the 2 % I didnt give them is because I would of loooove to see Sebastian running on the kitchen, the Seagull was a boy, also some songs that were Joy part of the movie and some other small details like Ariel brushing her hair while eating dinner and Ursula saying my poor little poops instead of my babies ."
Meron,5,Loved it! So did my girls! Anything set outside of a Denmark is a deviation from the original story so Im okay with the new faces! Will watch again.
Fulton,5,"Awesome movie.  We saw it in 3-D which made it even better.  It followed the original story very well, and the songs were great.  We will watch it again."
Ron,5,"This Movie is SO GOOD! It is everything that I'd hoped for. Halle Bailey is a SUPERSTAR. Between her MAGNIFICENT Voice & Acting Chops, she is a Force to be Reckoned With for decades to come. It doesn't hurt she is SUPER CUTE and one of the most Beautiful women in Film today!!!

Oh, by the way, Melissa McCarthy was Eye Poppingly Wonderful!! She showed range I never thought she had!! This movie is going to get her a lot more work when casting directors see how AMAZING she is in this movie. Obviously, same goes for Halle Bailey. What a performance!!

If it has a knock, and I'm NOT saying it does, it could have been 20 minutes shorter.

I REALLY loved this Movie, and I am in my 40's."
Tanisha,5,Loved it!  There were multiple messages in  this movie ! Love them all!
Quinton,5,This movie is great. Halle Bailey is phenomenal and the other actors are absolutely fantastic. This movie is definitely a must see.
GirlDad,5,I enjoyed the original LM with my niece and itll always be one of my favorites. This time Im with my own daughter and I love it even more!
Vanessa,5,It was an incredibly great movie! I am going to go see it again!
Chastity Canfall,5,My granddaughter and I loved the movie. Halle Bailey is amazing. She has a Beautiful Voice.
Dana,5,"I wasn’t expecting it to be as good as it was. My daughter and I wanted to see it again as soon as it ended. Excellent job by the entire cast!! If you’re debating, trust, you will not be disappointed."
Cathy,4,"Loved the movie, my granddaughter and nieces were so excited to see it. It did not dispoint, color was beautiful and the singing was great..."
Guillermo M,5,"Was very theatrical and movie had it's moments of spectacle. I thoroughly enjoyed, it's a great family film."
April S,5,"This movie was amazing, Halle was the perfect actress to play Ariel"
Stifon,5,So amazing! Enjoyed every minute of it.
Stephanie,5,I loved this movie so much!!  Halle Bailey was born for this role!! TWO THUMBS UP and FIVE STARS!!
Virginia Edwards,5,Phenomenal movie! Me and my daughter loved it
Arron,3,"Little mermaid was and still is one of my favorite movies. It was good for the culture to have a black mermaid, however they could have stayed true to the movie. The white girl gets saved and gets to live happily ever after but the black one is the hero. when will we get saved and stop trying to save everybody. the movie could have gone without the extra scenes and how did they drop the scene with Sébastien and the cook fighting. that was epic. why?"
Suzanne,5,Very entertaining.  Great cast of actors.  I recommend the movie
Tony,5,"This movie in 3-D was surprisingly amazing I love the way the images jumped off the screen. 10,000 stars I highly recommend this film."
Trey,5,The movie was awesome from start to finish!
Yaniqueca,5,We loved Halle as Ariel and the diversity of the movie! Everyone from different ethnicity and background from the cast and the mermaids made the movie superb! I like the message that Disney portrayed which is what we need in society today. Peace. Love and UNITY
April,4,She loved it! Boy have we evolved since the first version 34 years ago!  My daughter loved it and very appropriate as she is biracial so thank you!! Great movie the kids in the movie laughed and cheered.
Cassie Moore,5,I love this movie so much I a must see for all Disney lovers 😀
Wendell B,5,Movie was as great as animated version. It was well cast and delivered wonderfully!
Marquita K,5,I love this movie its my all time favorite movie   going to see it again.
Alexis,5,This was executed extremely well and did not disappoint.
Latisha J,5,"First of all, the new mermaid is beautiful! The overall message of the movie was very timely. Having seen the cartoon 1 million times, I thought that I would know this movie very well. I love the additions they have made to make the movie fresh. Very much recommend!"
Sharon F,5,our girls were ingagde the entire movie sing dancing in their seats.
Sheri,5,This movie was amazing. Halle Bailey gave Ariel made it a a reality that all dreams can come true for all little girls.  They have to remember that you dont have to give something up just to be heard by the ones you love.
Cindy,5,"Wonderful live action remake! Halle Berry has a powerful voice. Enjoyed Daveed Diggs as Sebastian, Akwafina as Scuttle. Lin Manuel Miranda added several great songs which added a nice update. I do think Melissa McCarthy was alittle scary for really small kids. She made a wicked splash as Ursula. Go & enjoy"
Yani,5,"The storyline, and plot was accurate to the original one. I really enjoyed it! Lots of humor, action and touching scenes."
Susanne Sears,5,Great color and music.
Dani C,4,Loved the new music and expanded story.  Didn't care for the prince's backstory as I don't feel it made a whole lot of sense for the movie as a whole.
Sandra,5,Loved Melissa McCarthy!
JSHAN08,5,Beautiful singing voice and beautiful mermaid!
Dana,5,"A MUST SEE for Disney fans !  I have seen The Little Mermaid twice and will probably see it again in the theater.  I have also bought the soundtrack. The acting, the special effects, the costumes, the music, the underwater and shoreline scenery -- it's all great !"
Barbara F,5,A classic favorite! Totally worth going to the theater to see it!!
Klaudine,4,Held the kid’s attention great Movie
Eugenia mercedes G,5,Wonderful movie I love you it
Ivette M,5,Amazing movie! Loved it!
Braelyn,5,Loved the movie! I liked the scenes they added to make the storyline a bit more complete. No longer just Ariel giving up everything for a pretty boy lol. Also loved Halle! She just has princess energy and such a beautiful voice!
Joy S,5,This movie was all and then more. I'm such a big kid at heart. I loved it 😍 ❤️
Brandeis G,5,It was everything you thought it was going to be times 10
Kelley,5,Visually stunning. I loved every minute of it
Vixen,5,It was very well done. The storyline stayed relatively the same and the color was amazing.
Emeka,5,Great ! Classic movie
Melanie,5,Excellent Movie. Heart touching. A must see movie.
Gregory D,5,"Beautifully shot, very funny, the new songs were great!"
leroy butler,5,"Truly an amazing movie, Oscar worthy  for sure,  HB was magnificent!!!"
Joan  F,5,I absolutely love the movie. The acting and singing were just terrific!
CD,5,"Great songs and performances, Halle was wonderful as Ariel!"
Roger Doger,3,"Eh, so so. Nice ending"
Jamaal,5,Great adaptation of the movie. Halle Bailey is a superstar!!
Devon,5,Awesome remake!!! Halle and cast did an impeccable job!!!!
Nick E,4,"This not only has all of the charm of the original, but the additions fit in very well. One of Disneys best reimagined classics."
Kia and Marcy,5,A awesome movie love it
Ben,3,One song Lin Manuel Miranda should take back and then a solid 4 star movie otherwise.
Douglas M,5,Incredible effects with beautiful shots. 3D is a must. The storyline stayed true with a few deviations. Absolutely loved it!
Rhonda S,5,The story line was great and just great characters and singing.
Jane,5,Great overall movie!
latosha reed,5,Absolutely amazing. Musical scenes and music was amazing. Halle did a great job bringing Ariel to life.
Dotty C,4,Too long but amazing visually.  Great old music.
Raymond L,5,"Absolute perfection and addressed all the deeply problematic, shallow things about the original"
Sean,5,Halle's voice is angelic and it was fun to watch this remake of a childhood favorite.
Candice,5,"My very first movie I saw in the theater was The Little Mermaid, the animated version and now I took my children to see this as their first movie! It did not disappoint. It was just as good as the first one."
Felicia,5,My girls & I Love it
Ari P,3,Easily the most emotional live action remake! Such a great movie!
Brandi,5,Amazing and beautiful movie
Sarah,5,Loved it! Music and costumes were fantastic!
Joyce,4,"Liked the special effects, but towards the end of the movie it might be a little scary for young kids."
Tonya,5,"Great movie! Although the cast did a great job, Halle Bailey had a standout performance. My daughters and I really enjoyed it."
Sharlz,5,amazing!! Sooo good!!!
Chris Ruiz,5,beautiful remake of the original. Halle girl u killed it congrats.
Kristi,2,I guess the non-animated version probably wasnt the best choice for my granddaughters to see the movie.  Overall it was ok. Not as attention - capturing as the original since it was more of a novelty idea.
Valencia,5,I absolutely loved the movie. Very good remake
Lorene McInnis,5,This movie is amazing!!! Love love love it!
Dina N,5,Halle did an AMAZING job.
JoeJoeInSF,5,Absolutely fun movie!  Beautifully made and wonderfully casted!
Attiyah L,5,It was soo good. Such a fun and captivating watch. Halle was definitely the stand out performance though everyone else did quite well. I only wish Ariel had more elaborate costumes. But I already can't wait to watch again.
Patricia,5,The acting is amazing and it looks so realistic! I love this movie so much and so does my daughter!
Lee Gartrell,5,I loved it and so did my family!  The Under water scenes were Breathtaking! And the Little Mermain Out-did herself!
ALLISON mc,5,I cried several times. Simply loved this live action remake.
Nekole,5,"My entire family went together to see this movie. This includes my 5 nieces, who all loved it and asked to come back and see it again. I loved it. The only thing that mattered to me was the smiles on their faces. The Halle is getting because of this role is Very disgusting."
Amanda,4,"I loved Ariel, she was so beautiful and an incredible singer. I loved the take on live action looking animals."
Danielle C,5,Love it! Very close to the original
Kia,5,The movie was good. Actually better than the cartoon that came out during my childhood. Its a must see.
Kelly,3,Ursula was a little much.  More Ariel less Sea Witch.  Everything else was very entertaining.   Way too long.  Kids in theater were getting restless.
Rachel M,5,Such an AMAZING live action remake. :-)
Windy,4,"Movies kept on pausing and stopped for 15 min!
However towed the end they gave us free passes to the next movies!"
Belinda,5,"Absolutely one of the best movies I've seen! 
The added parts were phenomenal!
I loved it!!"
Tracy,5,"I really loved this. Never been too into the live action remakes, but this was beautifully done Halle Bailey was amazing. And even as someone who grew up on the original, there were things here they were able to flesh out. Eric is a much more developed character., there relationship feels organic. Most of it is gorgeous. Highly recommend."
Taryn,5,Run don’t walk to see this movie. I had a ton of fun watching and felt totally immersed in the little mermaid universe.
Sierra,5,Halle was AMAZING my daughter was inspired. All she kept saying was i love her look  mommy i wanna sing like her !!!!  20 stars for HALLE! The movie was incredible! Each character held it down. !
Sandra,5,"I liked everything from the cast, acting, music. Hallie Bailey was AMAZING!"
DP,5,Beautifully done! Halle Bailey was perfect. The changes were subtle but meaningful. So happy for the generation who gets to grow up with this reimagined classic.
Merial L,5,Amazing Cinematography!!! FULL OF COLOR!!!! 🧜🏾‍♀️🧜🏾‍♀️🧜🏾‍♀️🧜🏾‍♀️🧜🏾‍♀️🧜🏾‍♀️🧜🏾‍♀️🧜🏾‍♀️🧜🏾‍♀️🧜🏾‍♀️
Ken Barker,5,Our 5 year old granddaughter was mesmerized. The singing was better than the original. Very well done.
Crystal W,5,it was amazing I absolutely loved it it was incredible very good movie
Jennifer,5,"Bravo! Such a beautiful movie, it kept with the best parts of the original and made it even better (and funnier)! Every actor was perfect for the role from Ariel to Scuttle. We loved it!"
Yolanda Regalado,5,I love the movie it brought me back so many memories when my little girl was little the singing and Actors were Wonderful..
Bj,5,Grandchildren age 6 and 9 loved it
Rebecca P,5,Good movie! Stayed pretty true to the original animated film.
Karina A,5,Just beautiful!!!!!!!!!
David,3,More action less talking. Under the sea was a welcome to my child memory ❤️
LILY V,5,"As a full grown adult who named her first daughter Ariel, favorite Disney Movie Princess, I absolutely loved this version! My 2 daughters loved it as well!!"
Jessica D,5,Halle and the cast did an amazing job in bringing the story to real life.
Terri,5,"I liked the story and Disney never disappoints when they put little characters in, to make us all laugh"
AL,5,"I loved it. All the music was good, the comedy was funny. The women stood out, Hallie, Melissa and Awkwafina were amazing. It made me feel good."
Abisola,5,Halle killed this role. Singing? Superb. Acting? Superb. Everything about her? Superb. Loved every second. The romance was so believable and made me swoon.
Princess Tianna,5,"Absolutely loved it. It had many nods to the original, but still made it relevant for today. In the end, love conquers hate."
Jared M,5,"It was a beautiful reimagining of The Little Mermaid. Halle Bailey is luminous and has a stunning voice. She perfectly embodies Ariel. Melissa McCarthy was a delight as Ursula. Javier Bardem made a great King Triton. Jonah is so handsome and talented. The whole cast was wonderful. The film is a visual and auditory treat. The orchestrations were well done. The three new songs were unnecessary, but they werent bad. Okay, Scuttlebutt was kinda bad.  Overall, though, the movie hit all the right spots for this huge longtime fan of TLM. I did fight to hold back my sobs towards the end. I am deeply moved.  Thank you Rob Marshall, Alan Menken, Howard Ashman, and Lin-Manuel Miranda for this gift."
Phyllis B,5,This movie is fantastic.
Gregory C,3,It runs a bit by long. Lots of younger viewers needed a beak or some two. Visually it is pretty remarkable.
Sundai,5,"Loved it! Stayed true to the original, and Halle has such a beautiful voice 😍"
Terrie,4,"Mellisa McCarthy was amazing as Ursula.  Awesome graphics for the water scenes.  Missed the part they eliminated for Sbastien almost being cooked, they should have found a way to include it. Really enjoyed the movie but they were trying so hard to be New and PC that they left some of the fun and quotable lines from the original story."
ydocjames,4,Halle Bailey was astonishing! Very fun and cute movie.
Rachel loggins,5,It was a fantastic movie
Kelly V,5,"Loved every minute of it, almost as much as my granddaughter did 💜"
Natasha,5,"Im not crying, yall are. Marvelous movie."
Chris,5,"Absolutely amazing, hit all the nostalgic parts also revitalized it with some modern takes to it. Loved it will watch again for sure!"
Katie D,5,"I loveeee this movie! The kids and the adults both enjoy such a great remake of the classic little mermaid! Halle Bailey was magnificent in this performance, such grace bringing the little mermaid back to life in this new generation! Can’t wait for what Disney prepare next!💜"
Stasha,5,It was a beautiful movie we enjoyed it
Nadia,5,Incredible and wonderful everyone did a great job. Halle did a brilliant job
Joanne,5,Super cute! Kids loved it!
nickey n,5,Halle Bailey is my ariel all the way the animated movie was my favorite movie growing up and the first movie I saw in theaters so I went to see this one for nostalgia I loved it when she sang part of your world I literally cried i know this movie will mean a lot to so many little girls  and it doesn't disappoint
Paul,4,"Not as magical as the original, but then I'm not 12 still either.  But this is sweet and charming and great under the sea CG."
Marie S,5,"it was an amazing movie, my girls loved it"
gina,4,"the underwater scenes looked amazing. All the songs you loved are in it and done well. 
only thing not really needed was Prince Eric's song. Definitely good family movie."
Amanda J,5,"Great acting, visuals and songs! Best live action remake of Disney so far."
Bethania D,5,A perfect remake to a classic. Love the cast. Beautiful story come to life.
Lisa D,4,"I love that Disney reimagined this beautiful classic! Some of the new songs felt a bit forced, but the film, the acting and the cgi was magical!"
Christine,5,"Wonder Movie! Great acting, Hallie Bailey was perfect for this role. Her essence was everything. Jonah Hauer-King was great as Eric. Melissa McCarthy was a great  villain character coming from a predominately humorous roles. Best CGI ever."
Tricia,5,Black mermaid representation in beautiful sea colors was inspiring including other cultures were represented under the sea.Fun musical scenes.Enjoyed the loving relationship between a father & daughter.There was great comedic moments from the accompanying cast of sea creatures
Lex,5,Phenomenal movie!! The kids really enjoyed it in 3D!!
Nakeyia,5,Absolutely amazing! The cast the flow of the movie itself! Loved it
Azea  C,5,Beautiful!! I love the under water world they created!! Its the classic story but better!!
Lynn noel,5,One of the best movies I've seen in a while
Abigail,2,"The cgi was horrible and the auto tune for the voices was too fake. They strayed from the actual story plot too much and a lot of things didnt make sense. Its worth going to see just to say youve seen it, but youll unfortunately leave underwhelmed.  2 stars"
Monique Dizon,1,The movie overall was cute but missed a lot of core elements from the original animated movie. I was literally falling asleep in the middle of the movie due to the large pauses.
Louann J H,5,Colors wee beautiful  dining was fantastic  and the villan was GREAT
Vanessa,5,Loved every minute of it!
Paloma,5,Loved that the plot/ story aligned with the original movie. The original songs were included and I thought it was cute that the original Ariel was a part of the movie too.
Josh,4,Great job Disney.   Paid homage to the OG.
Marchea S,5,I loved it! It was better than the original! Halle Bailey did a wonderful job.  The cinematography was beautiful!  I just absolutely loved it.  Awkwafina’s song was so cute!
Mary Copsey,5,Melissa McCartthy stole the show! Changed a little of the story and added new songs. My grandchildren and I loved it!
Olivia,4,I knew what was going to happen so I wish something would’ve been added but overall 8/10 singing was great. “Eric” could’ve been better. Almost a replica of the original
Lashaie,5,Absolutely amazing!!!!
Mia B.,5,The diversity of the cast and the special effects were great!
Anissa,5,I loved this version. The cinematography was superior and Halle Bailey did an exceptional job as the Little Mermaid. Visually beautiful masterpiece.
Niesha M,5,"This movie was such a great rendition of the original, obviously things were different because it was live action but I think the cast did an amazing job. I don’t have any issues with the few changes they made to movie to keep up with the times. The vocals were top notch and the acting from the lead roles were right on point. I would definitely see it again and if you haven’t seen don’t allow negative review dissuade from forming your opinion on it. Unfortunately the times we’re living in is causing people give low reviews simply because of the lead actress race(simply just sad world)."
Hannah,4,"We loved the music and the Kiss the Girl scene, Im also glad they stuck to the original story line"
Frenchyy,5,The singing was awesome and the cast was great
Jessie B,4,"a visually beautiful film. one song went on too long in my opinion and one sequence was too short. If the song would have been cut short for the film, that time given to the sequence at the end, and one more thing I don't want to say but it wouldn't add time just change a scene it would have been as close. to a perfect live action you could get. It's my favorite of the live action remakes."
Chris P,4,a new spin on the animated classic
Kei,5,"Phenomenal movie. Loved the new songs. Loved the end scene with Ariel and Dad. I saw the original when I was 9 in 1989 and I'm so thankful to be able to take my 9 year old to see a movie I loved so much. My daughter  enjoyed it as well and keeps saying ""Skuttlebutt""."
JC.Borrero,5,Was soooooo amazing! It completely exceeded my expectations!
Marcus,5,"Wonderful movie. I love that they stayed close to the original animated movie but, also added to it. Halle was an incredible Ariel. Melissa McCartney crushed it as Ursula."
Victoria J,5,Music and animation were fabulous!
Connie,5,We all over the movie!!  The time flew by!!!
mark H,4,Cinematography was amazing
Judah,1,"stop making these, please. either make it all CG or don't, or at least give us something new. would have been less wack if all the songs were new or if they just dropped the musical aspect all together. didn't feel like it was for the kids and it didn't feel like it was for fans of the original either, so who is this for besides Disney? pretty much felt like Disney giving itself a pat on the back for a job well done 40 years ago and cashing in on that a second time with a fraction of the effort. I'd never spend money on this and I regret doing so, only went because my girlfriend is susceptible to their marketing tactics. both thumbs down."
Eileen R,5,it was different than the original. it was delightful. Halle was lovely and has a beautiful singing voice. She added charm to the character. I especially like the ending.  Not just a wedding but the couple left to do something for the world together.
Heather P,5,"other than the whole thing about changing Ariel's race for no reason, the movie was fantastic. not sure why people are hating on it so much"
Denzel,5,"This was absolutely incredible! Love that the main characters are more fleshed out! The chemistry btw Ariel and Eric, so good! And I’m gonna say it bc I’m not afraid to, This Version is Better than the Original 🤷🏾‍♂️ good jobs Disney you outdid yourself!!"
Allison,5,OMG! Yes the BEST LITTLE MERMAID EVER!
Indira,5,"Exceptional film! I loved everything about this one including the additional 40 mins of storyline. Halle Bailey as Ariel was captivating and those big, beautiful doe eyes were perfect for his film. I must also admit I loved the fact that one of her sisters had my name. The diversity in case was outstanding!! Plan to see it again next weekend!"
Elizabeth W,5,We love the way Disney brought life to The Little Mermaid. The singing was heartfelt. I felt like she was talking to all the little girls /women in the audience.
Cesear,5,"movie was unbelievably perfect. couldn't have been any better. Disney actually made a perfect film. Don't follow hater critics. this movie beats the animated 1,000,000x 

a must see!!!! 🔥🔥🔥🔥🔥🔥🔥🔥🔥🔥"
Lorrie,5,Fantastic job on the actors playing the various roles. LOVED Melissa McCarthy as Ursula! Can't think of anyone better to fulfill that role. Xavier Bardem as King Triton was spot on as well. Halle Berry was perfect for Ariel. What a beautiful voice she has!  Plenty of humor and a few tears as well.
Shenyca,5,"The movie was soooo good..had us all on the edge of our seats... even though you know what's going to happen,  it still left your holding your breath waiting to see the next scene..."
Lyn,5,Way too many adds. Otherwise the movie its self was amazing . Im
Tieka,5,"Love the beauty scenes, and the representations! What a magical masterpiece! One of the best Disney live action movies"
Judy,4,The action was awesome.
Samantha,5,"The effects, the cast, everything was phenomenal"
Teri E,5,"It was colorful, close to the original and the singing was great!"
MILDRED M,3,Did not like the actor they chose for the little mermaid Disney could of done much better
KP,5,The movie held all the magical elements of a Disney animated film. Halle was stunning and Melissa did a wonderful job as Ursula!! Must see.
