Reviewer,Rating,Review Text
Deborah,4,"Beautiful effects, great music and a wonderful cast. It is enchanting!"
Olga,5,it was a great movie. ☺️☺️Very well made. ❤️. the songs were heart felt indeed. I will definitely go and see it again for sure♥️♥️♥️. Colors were Spectacular as well !!! Especially with the witch Ursela!!!
Amy,3,I would reccomend this movie. Anything Disney's I love.
Denise M,3,"Brought my granddaughter to see the movie and it was her first time at a movie theater.  She loved it, as did her mother and I.  Great characters.  A little longer for a four-year-old, but never dragged.  Melissa McCarthy was great as Ursula, and since I love Daveed Diggs, his portrayal as Sebastian was wonderful."
Tiffany,5,It was so awesome to experience in 3-D! It was a really nice wholesome family movie!
Murrie,5,The CGI was absolutely believable! Singing was exceptional!
Michael,5,Very entertaining and close to the original animated  one. Still awestruck with how they made the mermaids and underwater so scenes so realistic. Kudos the special effects people. The scenes of the storms on the sea were quite thrilling. Enjoyed it immensely and can't wait to see the next real life remake of a Disney classic.
Kim,5,My daughter and I loved the movie!! It was partly cast and gray all around!
Patricia L,5,"Very well done. Im not sure if its for small children as there are some scary parts. I like how the movie stuck to the original. The girl who played Ariel was very good, and the Prince was terrific. Very colorful with a huge assortment of sea animals!!!  Really enjoyed it!"
Marilyn,5,very enjoyable to watch
Chay,5,Excellent movie! Casting was outstanding!!
Sharalee,5,I was afraid that another childhood favorite would be ruined like The Lion King - but this great! I loved it! All the characters and the message was lovely. Great job!
Watch4one,5,I liked everything about this movie!
Michelle,5,The movie was so amazing.
Marie C,5,I thoroughly enjoyed the movie. Especially the underwater scenes. They stayed true to the plot not like other movies adding unnecessary bs. But I've always enjoyed the little mermaid movies. My daughter didn't like it though lol. The only negative comment I'd have to say is is that she looked a little animated while underwater but that's a given/expected.
LaMonica  L,5,"I loved the theme of accepting others and allowing your child to love others and pursue their dreams in life.  Great music, action, and overall picture imaging."
Marcus,5,I loved the music. Halle Bailey has the voice of an angel! She truly embodied the wonderment naivete of Ariel. I also loved the message at the end between Ariel and Triton. I am going to see it again!
Andi K,5,Personally I have no idea why the rating are so low. I went with my girlfriend and we both agree that (in our opinion) it is the best live remake Disney has ever made. Definitely worth going to see in theaters!
Sharon,5,It just was a feel good movie. It ended on a high note.
Momdiddy,5,Loved every second of this movie...my 4 year old granddaughter loved it too...Highly recommend seeing this version....I even cried at some points...
Jeannine G,5,"This movie was great!!!  The “remake” was perfect in all ways!  Truly, enjoyed!!!"
Lydia A,1,Really disappointed.
Keturah M,5,"This movie met ALL of my expectations! The casting was phenomenal, the acting was superb, Halle's voice is EVERYTHING!"
Christopher A,5,Fantastic remake. Did the original justice in so many ways.
Mario,5,This movie was so much fun and still true to the original. must watch!
Megan,5,It was pretty close to the original and there was some added new songs that were good. It was good for a life action remake.
Cindy M,4,Very enjoyable movie!!
Markee G.,5,"The acting, casting, & the way they executed the whole story was great for someone who wasn't sure they could pull this 1 off..the bad reviews are all wrong. If someone has a problem with it then they had a personal problem beforehand either way, because I loved it & am very excited for when it's available to own.."
Kim,5,Loved the new bits (like Scuttle's song) AND the parts that were true to original. Bailey was beautiful and that girl can sing!  Plus Prince Eric actor was great and Ursala (Melissa) did a fabulous job at being mean and scary. And always love Akwafina and Daveed!
Sandra,5,It was such a great movie. Halle Bailey was great. I really enjoyed it.
Shay,5,Movie was very good loved every minute of it
d,5,"Solid 8.5/10 go take your kids to see it, they’ll love it."
Fred F,3,Good special effects.
Maria,5,I just love The Little Mermaid anyway and thought they did a great job
Lin Win,5,"One of the best live action remake to date.  Must see movie for sure, you won’t be disappointed!"
Tawana,5,Halle was an excellent choice for Ariel!
Traci,4,"THERE IS SOMETHING INSPIRING ABOUT SEEING A MOVIE ON THE BIG SCENE THAT YOU WONT GET AT HOME.  WE SAW THE MOVIE IN 3-D (WHICH HAS COME A LONG WAY) AND IT WAS AMAZING WHEN UNDERWATER, NOT AS AMAZING ON THE LAND SCENES.  THE SONGS ARE AMAZING ALONG WITH THE VOICES OF THE SINGERS. i WOULD GO SEE IT AGAIN."
Shanta,5,Great movie! My daughter and I enjoyed it!
Monica,5,The singing and acting were great!
Tyrag,4,"This installment was beautiful and I appreciated the inclusivity of all the mermaids. The story line was awesome as usual and the acting was amazing! It felt like a short movie but it was 2hrs. Maybe I was enjoying it too much. Halle did a wonderful job as Ariel! The crab Sebastian played by Daveed Digs was awesome and Awkwafina as Scuttle was totally hilarious. Overall, bring your kid to watch this movie. Its enjoyable for both adults and children. I laughed a lot."
Symone,5,The movie was amazing and glad I was able to come see it with my little one.
Phil,5,"Loved the entire movie.  Halle Bailey was outstanding, and the other actors were equally remarkable.  What a masterpiece!  I only went to keep my wife company, and I am looking forward to seeing it again!"
Jacob M,5,"Halle Bailey was amazingly tender, hopeful, and strong.  Definitely worth a watch to re-live this updated Disney classic and see it a new light.  Scuttle (voiced by Awkafina) had me laughing out loud in the theater.  Enjoy!"
Carrie,4,Great new version of a classic!  When taking younger kids be aware that it is over 2 hours.
Jennifer R,5,"This movie is fantastic!!! I saw it in 3D, what an experience. Do yourself a favor and go see it, take a friend or two with you. The most diverse movie of all time.  Halle Bailey showed she is a gifted singer and very talented actress."
Felicia,5,It was absolutely amazing! I enjoyed EVERY MOMENT OF IT. It captured my 3 year old daughter's attention. 5 stars for HALLE!
Mouniratou,5,"Its was a wonderful experience, very well made"
Charles B,3,"Ariel and Eric were amazing. Very long film however, could have been shortened."
Christina P,5,"loved the movie, my children and nieces and nephew enjoyed the movie"
Dollie,5,I like the fact that the movie had all ethnic groups of people.
Sheila L,5,We loved It. It was excellent and welll done. Everyone in the theater clapped when it was over. A must see
Leslie D,5,We were so happy to be able to enjoy this charming retelling of the classic tale. The effects were wonderful and all characters were well acted. I highly recommend it to anyone.
Beautiful you,4,"Thank for asking My favorite was the the bird the crab and the fish.
The best part was bring everyone together"
Nikki,5,It was great movie. The acting was superb. I really like all the different representations in the movie.
Traci R.,5,It was a brilliant update to my favorite Disney movie. Halle Bailey as Ariel was more than my heart could take. Melissa McCarthy as Ursula was the best cast role ever. I cant wait to see it again.
Sanjaya L,5,I really loved the new live-action version.
Fred,5,"I liked the 3D experience,  it was like I was in the movie. Review from my 8 year old granddaughter.  She can't wait to see it again."
Alicia C,5,Best Disney live-action movie to date! The casting was perfect. Daveed Diggs stole the show as Sebastian the crab. The music was outstanding - better than the original. Halle has such an incredible voice! I have nothing bad to say about this movie. It exceeded my very high expectations.
Dawn,5,Casting was beautifully done!  Live action forever!
Kram8732,5,Loved The Little Mermaid! The original animated version was my daughters favorite movie so I was familiar with the story. The live action version nailed it and also ratcheted up the emotional tension. I kept tearing up at the beauty and drama I experienced. I highly recommend this movie!
Jenica J,5,Love the fresh Caribbean focus. Hailey was phenomenal as Ariel!!
Ronald,3,"Disney needs to get back to it's roots. Screw that woke crap and the diversity crap, just tell the story and quit worrying about peoples feelings."
R1AQU2EL.C,5,Amazing film.  The musical performances were excellent.
Daniel V,3,"Soundtrack was really good, but it just felt uninspired and flat. It was nice seeing the visuals, but it's got no substance in the story."
Trish N,5,"Oh my gosh!! Little mermaid was sooooo good. I was even ""that mom"" and took my 5 month old baby. He was locked on it (then fell asleep lol). 
But really. Bravo!! The movie was great"
DME,2,"Although Halle's voice nailed it, her acting skills fell very flat! She just looked confused and scared the whole time. Skuttle's voice was extremely hard to listen to, and it's sad they completely took out the chef scene. And poor Flounder! What happened to him?? And Ariel's hair - why was it orange?? They changed the look of many characters and not for the best. 

Ursula nailed it! I can't believe Melissa McCarthy's voice could sound like that. and the makeup and special effects were all done amazingly."
Kelly D,5,"My childhood brought to life, it was an incredible refresh of the classic in live action. The CGI of the underwater world was incredible and encapsulating, with amazing performances from Halle Bailey, Melissa McCarthy and Awkwafina in roles I’m convinced they were born to play. It’s a must see!"
Kathi,4,It was a cute movie and I loved all the sea creatures and underwater scenes. The only thing I didn’t like about it was that it was a bit too long. Other ten that I enjoyed it.
david,0,Blah. Couldn’t buy in to any of the voice actors. Some things don’t need to be re done.
TomTom,5,"Awesome movie, the story line add ins were amazing and really brought the story to life!"
Natalie A,5,Me and my daughter loved the movie. She kept commenting on how beautiful Ariel was! Good casting and my 15 year old son even enjoyed it.
Roger R,5,Beautiful movie! Halle Bailey really played the role of Ariel so well. I loved every minute of the movie.
Katrina,5,I loved how they kept it as close as possible to the original movie. It was amazing.
Terri,5,My adult daughter and I went to this movie.  Little Mermaid was her favorite movie growing up.  We both LOVED this new version.  We both thought all of the actors/actresses were spot on.  Can't wait to see it again when it becomes available to stream on Disney.  We both highly recommend.
Nisha,4,The movie was beautifully made. Didn't love some of the songs.
Joy S,5,"I love a musical, so I knew I was going to love it! My granddaughters were up clapping, dancing and singing with each musical number...my heart was light with love watching them watch Ariel just be..."
Marcie M,4,"I really enjoyed the innocence of this movie. Was very pleased to see there wasnt a work agenda. I have stayed clear of Disney and its products for a couple years now, but decided to give it another chance. Disney can win back my business if it stays on this track"
James,5,"We absolutely loved the new live action version of The Little Mermaid.  It was our daughter's first time seeing a movie in an actual theater.  She was captivated the entire time and has been asking to listen to the sound track non-stop ever since!

I think this was by far the best live action adaptation of an animated Disney film.  The cast selection was on amazing and Halle Lynn Bailey was outstanding as the titular character.  Her voice and performance were enchanting.

I can't recommend this movie enough!"
True Little Mermaid Fan,5,Excellent… Beautifully done. Loved the new songs
Dawn C,5,"I felt all the emotions that are typically missing from the animated version.
It was great!
I plan to watch it a few more times. It was that good!"
Diana,5,We absolutely loved it. We loved that you didnt change it but the little add ins made it better. The scenery was really so real looking
enlightened711,5,"The movie was excellent.  They stuck to the story line and the cgi was amazing.  Disney,  actors and creators created an outstanding project."
John Henny,5,A really great movie with great singing and acting
Nandi,5,"Great graphics, great music, great story, beautiful mermaids and funny crustaceans"
rayne.chi,5,"Beautiful imagery & suspenseful even if you've seen the cartoon version, it's sill thrilling."
Facebook U,3,The cartoon was better
priscilla Lattimore,5,The MOVIE was EXCEPTIONAL!! BUT THE THEATER WERE FREEZING  EVERYONE IN THERE COMPLAINED HOW COLD IT WERE
Taylor,5,Halle Bailey was the perfect choice for Ariel! A true Mermaid Princess!
Sara,5,I have always loved the cartoon and so have my Granddaughters. To bring it to life madecit even more special. The graphics were so realistic. I definitely recommend the 3D version.
TT,1,I really wanted to like it.
T. R.,5,"This movie was amazing, the kids loved it!"
rhoda r,5,It mirrored the animated version which we loved. The new songs were great.
Disney Fan,4,"Love that it stayed true to the original, just a bit long - probably could have cut some of the extra songs."
Jaziblu,5,Great and cute movie.
amber,5,I thought it was an exciting movie. The characters were very well portrayed. Alot more action than the original cartoon. Love it.
Angel B.,5,So good! Great performances from Halle Bailey and Melissa McCarthy! A Definite must see if you loved the little mermaid growing up!
Joanne,4,"Great to see this live action remake of a cartoon classic, featuring a diverse cast. For a parent, the underwater scenes are like a trip to the spa - very relaxing and beautiful."
Krys C,5,Loved everyone but Sebastian really.
Dan,4,"It was fun to reminisce about fun memories of the original. We took the whole family. Everyone had a good time, teens to children."
Sav,4,Cinematically were great. Kept all classic songs with a few new added in .
Larry,5,"I really loved the fact Disney did not change the storyline too much the graphics were very cool the music, the actors and It had its funny parts as well. I remember seeing the Little Mermaid in the morning before school when i was younger, and to see it now as an adult as a movie with the kids made me feel like the kid again."
Miami,5,"Loved the actors, happy Disney stuck to the original storyline, visuals were stunning, and the music was beautiful!"
Boy mom,5,My boys and I loved this movie! It was entertaining and beautifully made.
danielle,3,The voice was not as good as the original. Ursula was fantastic. The pigeon voice was very annoying.
Courtney,5,black girl magic my daughters loved to see someone like them as a mermaid as Ariel weve always seen her as white girl with red hair but to see brown skin and locs(with a boho style) was everything BLACK GIRLS ROCK!!
Khiley,5,"AMAZING!!!!!!! Loved every minute of it! The only thing I wasn't satisfied with, was Flounder did not look like Flounder. Other than that, it was perfect!"
Annap84,4,Very good overall - but some lines from original omitted
Brenda,5,"I loved this movie! Surprise beginning, Surprise endings  Although the storyline is basically the same storyline as the animation version, there is so much more visual affects that adults will appreciate. I’m not sure how much the pre K age would tolerate this movie. The length may lose the pre K’s attention. The family seated next to me had 3 children. Dad and 2 of the children did fine but the youngest ((maybe about 5 or 6) talked and fidgeted, made her mother leave the movie twice, and finally wanted to sit on her mothers lap who was sitting next to me. There is no way Mom enjoyed this movie. She would of been better off going to the movie arcade instead of disrupting everyone around her. She was very apologetic and polite so I don’t fault her for her taking care a her daughter. But it was distracting as I was on the end seat and they had to get out by me every time. This movie is made for the whole family including parents to enjoy. No profanity, no nudity, just sweet music everyone recognizes and a feel good feeling. I originally was to see it in IMAX and 3d but that theatre system was down so had to se the movie the traditional way. If you have the choice for IMAX or 3d. Choose one of those options. I feel the special affects would have been spectacular."
IJ,5,if you grew up watching original animated Disney films you will love this life action version of The Little Mermaid. I feel like they stay true to what made this movie so amazing to me as a kid. Wonderful acting and even more wonderful singing!
Kathy,5,CGI was amazing! Both grandkids loved it and my daughter and I loved it too. There were some intense moments so I wouldnt recommend for kids under 4 or those who are very sensitive. It did run long for a kids movie-ours had to take a bathroom break.
itsCamai,5,"I was honestly skeptical of this live action film, but it felt so close to the original — and better! The graphics were AMAZING and the actors casted were perfect. The length was just right. Overall it exceed my expectations. 5 stars!"
Cassandra,4,"I liked that Movie follows the org story line. 
I didnt like them changing the main character I think they should have made her look like the org Ariel"
Stephanie vieira,5,"Beautiful movie. The music, costumes and actors did amazing."
Paul,3,Casting and acting was awful.
Chucktowngirl,2,"Bad acting, too politically correct"
Karen,5,"I loved the Little Mermaid. The acting was subtle, not overdone, the singing was excellent and the settings were beautiful, especially the under water scenes. Well done."
Nelson,4,"The Little Mermaid remake was a enjoyable movie, with great music and beautiful visuals. However, the presence of young children in the row in front of me were talking and fidgeting throughout the film which became a distraction. Overall, I would recommend the movie to fans of the original, but I would advise parents to choose a earlier showing if they are bringing young children."
Senora,4,"Some parts of the movie was very entertaining, the singing was awesome.  Movie felt longer than expected."
Ebone,5,"I love the mix of ethnicities and Halle was literally perfect for that role. It was the perfect reenactment of the original.  All the actors were amazing.  Melissa Mccarthy is good in EVERY role she has ever played. The actor that played Eric was perfect. It was all so perfect.  I really enjoyed,  so much! Bravo to the team that put it all together!"
Jenise  R,5,The sing arrangements were better than ever
Morgan,5,"It's was amazing, especially in 3D. I love how they brought in a variety of nationalities and have it a new twist and look. Ariel a.k.a. Halle Bailey has the most amazing angelic voice, just beautiful."
Patricia Yancey,5,"Mesmerizing visuals and beautiful talent Halle is a spectacular actress. The cast was amazing and multicultural. My 4 year danced and sang , this was our second time watching this movie. We loved it so much"
"Angelique (Charlotte, NC)",5,"What a wonderfully fresh and artful way to tell an old story. Halles performance as Ariel was wonderful - she was beautiful, so darn cute and she nailed both the innocence and determination of the character. And her vocals - oh my goodness just flawless like an Angel!! There was humor, the music made me dance in my chair, the animation was phenomenal. Ursula was exactly as I remembered her. I could literally go on and on. Fantastic job to all involved in the production of the new Little Mermaid!"
Lisa F,4,"They are missing key music such as a good version of Fathoms below, daughters of Triton, and Les Poissons. I didn't mind the new additions, but missing those songs really disappointed me. The movie was fun, though the story line did not feel as fluid as the original. 

Sometimes you just shouldn't mess with the classics."
Danielle,5,Surprisingly enjoyable movie! Lots of diversity in this!
Rosalyn,5,Beautiful and true to story
Denise D,5,"I didnt know what to expect going in. I really enjoy the movie. This was a great remake. Disney did a great job with inclusion, I was pleasantly surprised."
Anne,4,Production of the movie was very well done. Enjoyed the entire thing.
Steve,1,I felt it didn't compare to the original animated one..
LV,1,Worth watching for Melissa. That’s all.
steve,4,"I saw no difference between the last movie , im disappointed GMA AND DISNEY made it a black and white thing.
The cinematic etc were very good, and Ursula stole the show!!"
Emanuel,5,"Movie was great, it was enjoyable, and Halle gave an amazing performance. Her singing was stellar and would definitely watch again. I will admit, some CGI parts were a little iffy, but it doesn't derail from the whole experience."
Raven,5,Honestly it was an great movie. Simpler like the first but yet different. It's an movie for all kids not just little girls. As an adult I enjoyed it also.
Sidney,5,Great movie for kids
AshBear,4,"Only thing missing that I was so looking forward to was the chef scene. Its been one of my favorites since I was almost 2. Chef Louie singing Les poissons, followed by the chase would have been a great scene. Alas we got a high school musical version of Eric singing to the ocean"
nakmuay,2,"The acting is not so great, and the story is a bit plain. I know that they followed the original one, but since it's a live action, they should adapt it to be realistic. I didn't see how Ariel got to be in love with the prince during the boat scene, which led her to save him, then chose him over her own dad. And the number scenes were kinda awkward for me, the acting didn't sync with the animation. lastly, I wished they could have done better with Ariel's costumes when she was on the land. Her outfit didn't suit her, and she had been wearing the same outfit for 3 days in the movie! (Even though her got wet from falling off the boat scene)"
Tiffany  J,5,"Excellent movie, heartwarming movie even for adults"
Antoinette,5,"Loved the music, storyline, acting, cinematography ! It was FANTASTIC!"
cathy w,4,"Great live action adaptation of cartoon, really enjoyed the new songs."
Cassandra B,5,"epic remake, killer soundtrack. must see im XD!!"
Abe,5,"Vivid visuals best seen in 3D. Successful upgrade from animation to live animation, with a couple new songs that fit perfectly into the original storyline, with intelligent updates to the script and lyrics. Talented (and beautiful) actors, voice actors, rendering and direction. Both"
Shawna,5,Super cute loved the mix up of the movie different parts
Torie C-C,5,Sad about a song that was taken out from the original but love the ones they added in.
Nancy A,5,I absolutely loved it! The visuals were fantastic too. Loves the little twist given to some events.
Sam,5,Much better than Mulan
UNC,5,"Great movie, with great people. Must see movie."
Daniel M,4,Halle is phenomenal and her voice is incredible! A couple of extra songs they added kind of felt like filler. But overall great adaptation.
Scherrie,5,"Please do not read some of the fake reviews. Many are upset because Halle is playing Ariel- racism still exists! Anyway, this movie is great! I loved everyone in the movie. Melissa McCarthy is wonderful, Halle’s voice is amazing, the young  man that played Prince Eric is just amazing- I loved it all! I want to see it again. It is so cute,  has some funny moments and just… great as the original! For real, go check it out for yourself!"
